<?xml version="1.0" encoding="UTF-8"?>
<!--Sample XML file generated by XMLSpy v2006 rel. 3 sp1 (http://www.altova.com)-->
<CBITrfBonLogMsg xmlns="urn:CBI:xsd:CBITrfBonLogMsg.00.01.01" xmlns:xsi="http://www.w3.org/2001/XMLSchema-instance" xsi:schemaLocation="urn:CBI:xsd:CBITrfBonLogMsg.00.01.01
D:\java\projects\flowmanager-svn\converter\converter\docs\CBIInfTrfReq\xsd\CBITrfBonLogMsg.00.01.01.xsd">
	<LogMsgHdr>
		<MsgId>String</MsgId>
		<CreDtTm>2001-12-17T09:30:47.0Z</CreDtTm>
		<MsgTpCd>TRF-BON</MsgTpCd>
		<Sndr>
			<CUC>AAAAAAAA</CUC>
			<ABICd>00000</ABICd>
		</Sndr>
		<Rcvr>
			<CUC>AAAAAAAA</CUC>
			<SIACd>AAAAA</SIACd>
		</Rcvr>
		<NbOfDisp>2</NbOfDisp>
	</LogMsgHdr>
	<LogMsgCoreInf>
		<Disp>
			<NumDisp>2</NumDisp>
			<DispCreDt>000000</DispCreDt>
			<IBANBnNew>aa00a</IBANBnNew>
			<IBANBnOld>aa00a</IBANBnOld>
			<CRO>String</CRO>
			<Ord>String</Ord>
			<Benef>String</Benef>
			<CodRif>String</CodRif>
			<Descr>String</Descr>
			<CBIAddtlInf>String</CBIAddtlInf>
			<CBIAddtlInf>String</CBIAddtlInf>
			<CBIAddtlInf>String</CBIAddtlInf>
		</Disp>
	</LogMsgCoreInf>
</CBITrfBonLogMsg>
